[
  {
    "file": "lsdmu_apx01_s01.json",
    "section_file": "lsdmu_apx01_s01.md",
    "title": "APPENDIX I: What Dies and Is Reborn?",
    "chapter": 0,
    "section": 1,
    "words_target": 1000
  },
  {
    "file": "lsdmu_fm_s05.json",
    "section_file": "lsdmu_fm_s05.md",
    "title": "INTRODUCTION: 73 Days",
    "chapter": 0,
    "section": 5,
    "words_target": 400
  },
  {
    "file": "lsdmu_c01_s00.json",
    "section_file": "lsdmu_c01_s00.md",
    "title": "The Path of Temporary Immersion",
    "chapter": 1,
    "section": 0,
    "words_target": 1000
  },
  {
    "file": "lsdmu_c01_s01.json",
    "section_file": "lsdmu_c01_s01.md",
    "title": "lsdmu_c01_s01",
    "chapter": 1,
    "section": 1,
    "words_target": 1000
  },
  {
    "file": "lsdmu_c01_s02.json",
    "section_file": "lsdmu_c01_s02.md",
    "title": "lsdmu_c01_s02",
    "chapter": 1,
    "section": 2,
    "words_target": 1000
  },
  {
    "file": "lsdmu_c01_s03.json",
    "section_file": "lsdmu_c01_s03.md",
    "title": "LSD Sessions as a Path of Spiritual Awakening",
    "chapter": 1,
    "section": 3,
    "words_target": 1000
  },
  {
    "file": "lsdmu_c01_s04.json",
    "section_file": "lsdmu_c01_s04.md",
    "title": "lsdmu_c01_s04",
    "chapter": 1,
    "section": 4,
    "words_target": 1000
  },
  {
    "file": "lsdmu_c01_s05.json",
    "section_file": "lsdmu_c01_s05.md",
    "title": "lsdmu_c01_s05 — LSD Sessions as a Journey of Cosmic Exploration",
    "chapter": 1,
    "section": 5,
    "words_target": 1000
  },
  {
    "file": "lsdmu_c01_s06.json",
    "section_file": "lsdmu_c01_s06.md",
    "title": "lsdmu_c01_s06",
    "chapter": 1,
    "section": 6,
    "words_target": 1000
  },
  {
    "file": "lsdmu_c01_s07.json",
    "section_file": "lsdmu_c01_s07.md",
    "title": "The Craft of Remembering (lsdmu_c01_s07)",
    "chapter": 1,
    "section": 7,
    "words_target": 1000
  },
  {
    "file": "lsdmu_c01_s08.json",
    "section_file": "lsdmu_c01_s08.md",
    "title": "lsdmu_c01_s08: Defining the Conversation",
    "chapter": 1,
    "section": 8,
    "words_target": 1000
  },
  {
    "file": "lsdmu_c01_s09.json",
    "section_file": "lsdmu_c01_s09.md",
    "title": "The Participatory Dynamics of Disclosure (lsdmu_c01_s09)",
    "chapter": 1,
    "section": 9,
    "words_target": 1000
  },
  {
    "file": "lsdmu_c01_s10.json",
    "section_file": "lsdmu_c01_s10.md",
    "title": "lsdmu_c01_s10 — Platforms of Experience",
    "chapter": 1,
    "section": 10,
    "words_target": 1000
  },
  {
    "file": "lsdmu_c01_s11.json",
    "section_file": "lsdmu_c01_s11.md",
    "title": "Calling Down Heaven",
    "chapter": 1,
    "section": 11,
    "words_target": 1000
  },
  {
    "file": "lsdmu_c01_s12.json",
    "section_file": "lsdmu_c01_s12.md",
    "title": "The Suffering of Death and Rebirth",
    "chapter": 1,
    "section": 12,
    "words_target": 1000
  },
  {
    "file": "lsdmu_c02_s00.json",
    "section_file": "lsdmu_c02_s00.md",
    "title": "Crossing the Boundary of Birth and Death",
    "chapter": 2,
    "section": 0,
    "words_target": 1000
  },
  {
    "file": "lsdmu_c02_s01.json",
    "section_file": "lsdmu_c02_s01.md",
    "title": "The Welcoming",
    "chapter": 2,
    "section": 1,
    "words_target": 400
  },
  {
    "file": "lsdmu_c02_s02.json",
    "section_file": "lsdmu_c02_s02.md",
    "title": "The Perinatal Domain",
    "chapter": 2,
    "section": 2,
    "words_target": 1000
  },
  {
    "file": "lsdmu_c02_s03.json",
    "section_file": "lsdmu_c02_s03.md",
    "title": "Ego-Death",
    "chapter": 2,
    "section": 3,
    "words_target": 400
  },
  {
    "file": "lsdmu_c02_s04.json",
    "section_file": "lsdmu_c02_s04.md",
    "title": "Addendum: The Perinatal Level of Consciousness",
    "chapter": 2,
    "section": 4,
    "words_target": 400
  },
  {
    "file": "lsdmu_c03_s00.json",
    "section_file": "lsdmu_c03_s00.md",
    "title": "A Session Day",
    "chapter": 3,
    "section": 0,
    "words_target": 400
  },
  {
    "file": "lsdmu_c04_s00.json",
    "section_file": "lsdmu_c04_s00.md",
    "title": "The Ocean of Suffering",
    "chapter": 4,
    "section": 0,
    "words_target": 400
  },
  {
    "file": "lsdmu_c04_s01.json",
    "section_file": "lsdmu_c04_s01.md",
    "title": "The Ocean of Suffering",
    "chapter": 4,
    "section": 1,
    "words_target": 400
  },
  {
    "file": "lsdmu_c04_s02.json",
    "section_file": "lsdmu_c04_s02.md",
    "title": "The Riddle of the Ocean of Suffering",
    "chapter": 4,
    "section": 2,
    "words_target": 400
  },
  {
    "file": "lsdmu_c04_s03.json",
    "section_file": "lsdmu_c04_s03.md",
    "title": "On the Eve of Stopping",
    "chapter": 4,
    "section": 3,
    "words_target": 400
  },
  {
    "file": "lsdmu_c05_s00.json",
    "section_file": "lsdmu_c05_s00.md",
    "title": "Deep Time and the Soul",
    "chapter": 5,
    "section": 0,
    "words_target": 400
  },
  {
    "file": "lsdmu_c05_s01.json",
    "section_file": "lsdmu_c05_s01.md",
    "title": "My Life as a Completed Whole",
    "chapter": 5,
    "section": 1,
    "words_target": 400
  },
  {
    "file": "lsdmu_c05_s02.json",
    "section_file": "lsdmu_c05_s02.md",
    "title": "The Great Oak and the Hillside of Karma",
    "chapter": 5,
    "section": 2,
    "words_target": 400
  },
  {
    "file": "lsdmu_c05_s03.json",
    "section_file": "lsdmu_c05_s03.md",
    "title": "Rooted in Time",
    "chapter": 5,
    "section": 3,
    "words_target": 400
  },
  {
    "file": "lsdmu_c05_s04.json",
    "section_file": "lsdmu_c05_s04.md",
    "title": "Reincarnation and the Soul",
    "chapter": 5,
    "section": 4,
    "words_target": 400
  },
  {
    "file": "lsdmu_c05_s05.json",
    "section_file": "lsdmu_c05_s05.md",
    "title": "Stepping-Stones",
    "chapter": 5,
    "section": 5,
    "words_target": 400
  },
  {
    "file": "lsdmu_c05_s06.json",
    "section_file": "lsdmu_c05_s06.md",
    "title": "Stopping My Sessions",
    "chapter": 5,
    "section": 6,
    "words_target": 400
  },
  {
    "file": "lsdmu_c05_s07.json",
    "section_file": "lsdmu_c05_s07.md",
    "title": "Addendum: Other Instances of Future-Seeing",
    "chapter": 5,
    "section": 7,
    "words_target": 400
  },
  {
    "file": "lsdmu_c06_s00.json",
    "section_file": "lsdmu_c06_s00.md",
    "title": "Initiation into the Universe",
    "chapter": 6,
    "section": 0,
    "words_target": 400
  },
  {
    "file": "lsdmu_c06_s01.json",
    "section_file": "lsdmu_c06_s01.md",
    "title": "Expanding the Narrative—Who Is the Patient?",
    "chapter": 6,
    "section": 1,
    "words_target": 400
  },
  {
    "file": "lsdmu_c06_s02.json",
    "section_file": "lsdmu_c06_s02.md",
    "title": "Why Did the Suffering End?",
    "chapter": 6,
    "section": 2,
    "words_target": 400
  },
  {
    "file": "lsdmu_c07_s00.json",
    "section_file": "lsdmu_c07_s00.md",
    "title": "The Greater Real of Archetypal Reality",
    "chapter": 7,
    "section": 0,
    "words_target": 400
  },
  {
    "file": "lsdmu_c07_s01.json",
    "section_file": "lsdmu_c07_s01.md",
    "title": "Entering Archetypal Reality",
    "chapter": 7,
    "section": 1,
    "words_target": 400
  },
  {
    "file": "lsdmu_c07_s02.json",
    "section_file": "lsdmu_c07_s02.md",
    "title": "The Living Forces of Archetypal Reality",
    "chapter": 7,
    "section": 2,
    "words_target": 400
  },
  {
    "file": "lsdmu_c07_s03.json",
    "section_file": "lsdmu_c07_s03.md",
    "title": "The Tissue of Our Collective Being",
    "chapter": 7,
    "section": 3,
    "words_target": 400
  },
  {
    "file": "lsdmu_c07_s04.json",
    "section_file": "lsdmu_c07_s04.md",
    "title": "A Note on the “Gods” of the Subtle Level",
    "chapter": 7,
    "section": 4,
    "words_target": 400
  },
  {
    "file": "lsdmu_c07_s05.json",
    "section_file": "lsdmu_c07_s05.md",
    "title": "Session 28",
    "chapter": 7,
    "section": 5,
    "words_target": 400
  },
  {
    "file": "lsdmu_c07_s06.json",
    "section_file": "lsdmu_c07_s06.md",
    "title": "The Cycle of Purification",
    "chapter": 7,
    "section": 6,
    "words_target": 400
  },
  {
    "file": "lsdmu_c07_s07.json",
    "section_file": "lsdmu_c07_s07.md",
    "title": "Reincarnation and Collective Purification",
    "chapter": 7,
    "section": 7,
    "words_target": 400
  },
  {
    "file": "lsdmu_c07_s08.json",
    "section_file": "lsdmu_c07_s08.md",
    "title": "A Note on Learning How to Learn in Psychedelic States",
    "chapter": 7,
    "section": 8,
    "words_target": 400
  },
  {
    "file": "lsdmu_c07_s09.json",
    "section_file": "lsdmu_c07_s09.md",
    "title": "A Flash of “God”",
    "chapter": 7,
    "section": 9,
    "words_target": 400
  },
  {
    "file": "lsdmu_c07_s10.json",
    "section_file": "lsdmu_c07_s10.md",
    "title": "Addendum: Plato, Jung, and Archetypes",
    "chapter": 7,
    "section": 10,
    "words_target": 400
  },
  {
    "file": "lsdmu_c08_s00.json",
    "section_file": "lsdmu_c08_s00.md",
    "title": "A Benediction of Blessings",
    "chapter": 8,
    "section": 0,
    "words_target": 400
  },
  {
    "file": "lsdmu_c08_s01.json",
    "section_file": "lsdmu_c08_s01.md",
    "title": "Reflections",
    "chapter": 8,
    "section": 1,
    "words_target": 400
  },
  {
    "file": "lsdmu_c09_s00.json",
    "section_file": "lsdmu_c09_s00.md",
    "title": "The Birth of the Future Human",
    "chapter": 9,
    "section": 0,
    "words_target": 400
  },
  {
    "file": "lsdmu_c09_s01.json",
    "section_file": "lsdmu_c09_s01.md",
    "title": "The Visions of Awakening",
    "chapter": 9,
    "section": 1,
    "words_target": 400
  },
  {
    "file": "lsdmu_c09_s02.json",
    "section_file": "lsdmu_c09_s02.md",
    "title": "The Great Awakening",
    "chapter": 9,
    "section": 2,
    "words_target": 400
  },
  {
    "file": "lsdmu_c09_s03.json",
    "section_file": "lsdmu_c09_s03.md",
    "title": "The Nonlinear Dynamics of Awakening",
    "chapter": 9,